{
  "$schema": "http://json-schema.org/draft-07/schema#",
  "$ref": "#/definitions/OrderCreatedEvent",
  "definitions": {
    "OrderCreatedEvent": {
      "discriminator": "orderEventType",
      "description": "Represents an order that has been created by the order management system",
      "type": "object",
      "discriminatorValue": "OrderCreatedEvent",
      "additionalProperties": true,
      "required": [
        "orderEventType",
        "id",
        "purchaseOrderNumber",
        "purchaseOrderDate"
      ],
      "properties": {
        "id": {
          "anyOf": [
            {
              "type": "string"
            },
            {
              "type": "null"
            }
          ],
          "description": "Unique identifier for the entity, can be null on create if auto-generated"
        },
        "orderEventType": {
          "type": "string",
          "description": "Discriminator identifying the specific type of event instance (for example, OrderStatusEvent)"
        },
        "auditInfo": {
          "type": "object",
          "description": "Defines standard system audit fields available for most types",
          "additionalProperties": true,
          "required": [
            "isDeleted",
            "createdBy",
            "updatedBy",
            "updatedDate",
            "createdDate"
          ],
          "properties": {
            "createdDate": {
              "anyOf": [
                {
                  "type": "string",
                  "format": "date-time"
                },
                {
                  "type": "null"
                }
              ],
              "description": "Timestamp of when the entity was created"
            },
            "createdBy": {
              "type": "string",
              "description": "Identifies the system or user which created the entity"
            },
            "updatedDate": {
              "anyOf": [
                {
                  "type": "string",
                  "format": "date-time"
                },
                {
                  "type": "null"
                }
              ],
              "description": "Timestamp of when the entity was last updated"
            },
            "updatedBy": {
              "type": "string",
              "description": "Identifies the system or user which last updated the entity"
            },
            "isDeleted": {
              "anyOf": [
                {
                  "type": "boolean"
                },
                {
                  "type": "null"
                }
              ],
              "description": "Indicates whether or not the entity has been soft-deleted"
            }
          }
        },
        "purchaseOrderNumber": {
          "type": "string",
          "description": "References the original purchase order"
        },
        "purchaseOrderDate": {
          "type": "string",
          "description": "Date the purchase order was created",
          "format": "date"
        },
        "purchasingOrganizationCode": {
          "type": "string",
          "description": "B2B code identifying the organization that submitted the purchase order"
        }
      }
    }
  }
}